{
  "profile_id": "PVPF-DEMO",
  "project_id": "PRJ-20990101-DEMO",
  "profile_version": "PVPFV-1",
  "maturity": "COLD_START",
  "maturity_status": "COLD_START",
  "industry_pack_binding": {
    "pack_id": "PROFESSIONAL_SERVICES",
    "pack_version": "1.0.0"
  },
  "overlay_bindings": [
    {
      "overlay_id": "BRAND_ASSET_INTEGRITY",
      "overlay_version": "1.0.0"
    }
  ],
  "preferred_visual_modes": [],
  "preferred_asset_channels": [],
  "identity_invariants": ["Keep the fictional subject identity stable."],
  "confirmed_preferences": [],
  "rejected_directions": ["GENERIC_CARD_TEMPLATE"],
  "approved_reference_assets": [],
  "source_rule_versions": [],
  "asset_source_preferences": [],
  "background_preferences": [],
  "image_realism_preferences": [],
  "photography_preferences": [],
  "illustration_preferences": [],
  "character_preferences": [],
  "space_preferences": [],
  "product_preferences": [],
  "composition_preferences": [],
  "visual_focus_preferences": [],
  "whitespace_preferences": [],
  "visual_density_preferences": [],
  "typography_preferences": [],
  "font_family_preferences": [],
  "title_size_preferences": [],
  "body_size_preferences": [],
  "font_weight_preferences": [],
  "line_height_preferences": [],
  "letter_spacing_preferences": [],
  "alignment_preferences": [],
  "color_preferences": [],
  "accent_color_preferences": [],
  "contrast_preferences": [],
  "effect_preferences": [],
  "shadow_preferences": [],
  "gradient_preferences": [],
  "mask_preferences": [],
  "border_preferences": [],
  "corner_preferences": [],
  "texture_preferences": [],
  "formal_text_policy": "RENDERER_ONLY",
  "image_text_policy": "TEXT_FREE_GENERATED_VISUALS",
  "preferred_page_counts": [6],
  "preferred_candidate_counts": [2, 3],
  "production_batch_preferences": ["First page before remaining pages"],
  "quality_thresholds": {
    "direction_candidate": 75,
    "formal_asset": 85,
    "group": 85,
    "core_dimension_floor": 3
  },
  "approved_reference_elements": [],
  "rejected_reference_elements": ["Generic card grid"],
  "must_rules": [],
  "must_not_rules": [],
  "prefer_rules": [],
  "avoid_rules": ["Generic card grid"],
  "confirmed_feedback_refs": [],
  "rule_version_refs": [],
  "known_exceptions": [],
  "review_required_reasons": [],
  "cover_account_goal_preferences": ["LEAD_GENERATION"],
  "cover_objective_preferences": ["PAINPOINT_DIRECT", "AUDIENCE_FILTER"],
  "cover_primary_hook_length_preferences": ["6-16 visible characters"],
  "cover_primary_hook_line_preferences": ["Maximum 3 lines"],
  "cover_secondary_line_preferences": ["Maximum 2 lines"],
  "cover_text_prominence_preferences": ["Primary hook first"],
  "cover_text_area_preferences": ["Large safe-area text field"],
  "cover_text_to_image_ratio_preferences": ["42:58"],
  "cover_thumbnail_font_preferences": ["Readable at 310x414 and 186x248"],
  "cover_alignment_preferences": ["Composition-derived"],
  "cover_contrast_preferences": ["WCAG-like text contrast"],
  "cover_effect_preferences": ["Restrained and semantic"],
  "cover_background_semantic_preferences": ["DIRECT_BUSINESS_SCENE"],
  "cover_approved_reference_elements": [],
  "cover_rejected_reference_elements": ["Decorative-only backgrounds"],
  "confirmed_by_operator": false,
  "run_id": "RUN-20990101-010203-DEMO",
  "schema_version": "1.0.0",
  "created_at": "2099-01-01T01:02:03.000Z",
  "updated_at": "2099-01-01T01:02:03.000Z"
}
